{
  "schema_version": "2.0.0",
  "product": {
    "id": "replace_me",
    "name": "",
    "family": "COLD_DRINK",
    "subcategory": null,
    "status": "DRAFT",
    "description": null,
    "unit": "piece",
    "serving_size_g": null,
    "serving_size_ml": null
  },
  "commercial": {
    "sale_price_eur": null,
    "price_status": "UNKNOWN",
    "reference_value_eur": null,
    "bundle_eligible": true,
    "price_tiers_eligible_eur": [],
    "customer_value_notes": null
  },
  "dietary": {
    "vegan": null,
    "vegetarian": null,
    "allergens": [],
    "claim_evidence": "NONE",
    "cross_contamination_notes": null
  },
  "signature": {
    "class": "STANDARDIZABLE",
    "customer_value_score": null,
    "signature_operations": [],
    "proprietary_specification": null,
    "notes": null
  },
  "internal_production": {
    "possible": false,
    "cost_status": "UNKNOWN",
    "material_cost_eur": null,
    "operations": [
      {
        "task": "replace_me",
        "active_labor_minutes_per_batch": 0,
        "elapsed_minutes_per_batch": null,
        "labor_tier": "apprentice",
        "notes": null
      }
    ],
    "energy_cost_eur": null,
    "packaging_cost_eur": null,
    "cleaning_handling_cost_eur": null,
    "expected_loss_cost_eur": null,
    "other_avoidable_cost_eur": null,
    "avoidable_cost_total_eur": null,
    "batch_size_units": null,
    "production_notes": null
  },
  "external_sourcing": {
    "possible": false,
    "sources": []
  },
  "stock_and_conservation": {
    "storage_mode": "UNKNOWN",
    "internal_shelf_life_hours": null,
    "after_opening_shelf_life_hours": null,
    "freezable": null,
    "thawing_rules_documented": null,
    "current_stock_units": null,
    "minimum_stock_units": null,
    "target_stock_units": null,
    "expected_waste_rate": null,
    "conservation_notes": null
  },
  "decision_inputs": {
    "customer_indifference_score": null,
    "supplier_quality_advantage_score": null,
    "labor_saving_score": null,
    "purchasing_stock_simplification_score": null,
    "conservation_advantage_score": null,
    "traceability_advantage_score": null,
    "supplier_risk_score": null,
    "recommended_mode": "UNDECIDED",
    "decision_status": "PROVISIONAL",
    "decision_notes": null
  },
  "data_quality": {
    "confidence": "LOW",
    "missing_critical_fields": [
      "internal_production.avoidable_cost_total_eur",
      "commercial.sale_price_eur",
      "stock_and_conservation.internal_shelf_life_hours"
    ],
    "sources": [],
    "last_reviewed": "2026-09-10",
    "review_notes": null
  }
}
