{
  "schema_version": "2.0.0",
  "product": {
    "id": "bissap_maison",
    "name": "Bissap maison",
    "family": "COLD_DRINK",
    "subcategory": null,
    "status": "ACTIVE",
    "description": null,
    "unit": "cup",
    "serving_size_g": null,
    "serving_size_ml": 250
  },
  "commercial": {
    "sale_price_eur": null,
    "price_status": "UNKNOWN",
    "reference_value_eur": null,
    "bundle_eligible": true,
    "price_tiers_eligible_eur": [],
    "customer_value_notes": "Produit différenciant par la recette maison."
  },
  "dietary": {
    "vegan": true,
    "vegetarian": true,
    "allergens": [],
    "claim_evidence": "INTERNAL_RECIPE_DOCUMENTED",
    "cross_contamination_notes": null
  },
  "signature": {
    "class": "INHOUSE_SIGNATURE_ADVANTAGE",
    "customer_value_score": 4.5,
    "signature_operations": [
      "recette",
      "dosage",
      "infusion",
      "sucrage",
      "finition"
    ],
    "proprietary_specification": "Recette maison à documenter et versionner.",
    "notes": "Candidat MAKE stratégique."
  },
  "internal_production": {
    "possible": true,
    "cost_status": "UNKNOWN",
    "material_cost_eur": null,
    "operations": [
      {
        "task": "weigh_dried_hibiscus",
        "active_labor_minutes_per_batch": 2,
        "elapsed_minutes_per_batch": 2,
        "labor_tier": "apprentice",
        "notes": null
      },
      {
        "task": "infusion_monitoring",
        "active_labor_minutes_per_batch": 1,
        "elapsed_minutes_per_batch": 30,
        "labor_tier": "apprentice",
        "notes": "30 min d'infusion, 1 min de surveillance : 29 min restent disponibles."
      },
      {
        "task": "filter_and_bottle",
        "active_labor_minutes_per_batch": 4,
        "elapsed_minutes_per_batch": 4,
        "labor_tier": "apprentice",
        "notes": null
      }
    ],
    "energy_cost_eur": null,
    "packaging_cost_eur": null,
    "cleaning_handling_cost_eur": null,
    "expected_loss_cost_eur": null,
    "other_avoidable_cost_eur": null,
    "avoidable_cost_total_eur": null,
    "batch_size_units": null,
    "production_notes": "Mesurer coût matière par batch, temps réel par batch, emballage et pertes."
  },
  "external_sourcing": {
    "possible": true,
    "sources": []
  },
  "stock_and_conservation": {
    "storage_mode": "CHILLED",
    "internal_shelf_life_hours": null,
    "after_opening_shelf_life_hours": null,
    "freezable": null,
    "thawing_rules_documented": null,
    "current_stock_units": null,
    "minimum_stock_units": null,
    "target_stock_units": null,
    "expected_waste_rate": null,
    "conservation_notes": "Durée de conservation interne à mesurer et documenter avant décision définitive."
  },
  "decision_inputs": {
    "customer_indifference_score": 1.5,
    "supplier_quality_advantage_score": 1.0,
    "labor_saving_score": 2.0,
    "purchasing_stock_simplification_score": 2.0,
    "conservation_advantage_score": 4.0,
    "traceability_advantage_score": 3.0,
    "supplier_risk_score": 2.5,
    "recommended_mode": "MAKE",
    "decision_status": "PROVISIONAL",
    "decision_notes": "Orientation MAKE fondée sur la valeur signature; coûts réels encore à mesurer."
  },
  "data_quality": {
    "confidence": "MEDIUM",
    "missing_critical_fields": [
      "internal_production.avoidable_cost_total_eur",
      "commercial.sale_price_eur",
      "stock_and_conservation.internal_shelf_life_hours",
      "internal_production.batch_size_units"
    ],
    "sources": [
      "Doctrine interne Make_or_Buy"
    ],
    "last_reviewed": "2026-09-10",
    "review_notes": null
  }
}
