{
  "schema_version": "2.0.0",
  "product": {
    "id": "jus_gingembre_maison",
    "name": "Jus de gingembre maison",
    "family": "COLD_DRINK",
    "subcategory": null,
    "status": "DRAFT",
    "description": null,
    "unit": "cup",
    "serving_size_g": null,
    "serving_size_ml": 250
  },
  "commercial": {
    "sale_price_eur": 2.0,
    "price_status": "ESTIMATED",
    "reference_value_eur": null,
    "bundle_eligible": true,
    "price_tiers_eligible_eur": [],
    "customer_value_notes": "Positionné 0,40 € sous le Coca 33 cl pris comme référence de rayon (2,40 €)."
  },
  "dietary": {
    "vegan": null,
    "vegetarian": null,
    "allergens": [],
    "claim_evidence": "NONE",
    "cross_contamination_notes": null
  },
  "signature": {
    "class": "INHOUSE_SIGNATURE_ADVANTAGE",
    "customer_value_score": null,
    "signature_operations": [],
    "proprietary_specification": null,
    "notes": "Hypothèse doctrinale GINGER_JUICE_HOUSE : goût distinctif, recette maison."
  },
  "internal_production": {
    "possible": true,
    "cost_status": "UNKNOWN",
    "material_cost_eur": null,
    "operations": [],
    "energy_cost_eur": null,
    "packaging_cost_eur": null,
    "cleaning_handling_cost_eur": null,
    "expected_loss_cost_eur": null,
    "other_avoidable_cost_eur": null,
    "avoidable_cost_total_eur": null,
    "batch_size_units": null,
    "production_notes": "Gestes, minutes immobilisées et taille de lot à chronométrer au fournil."
  },
  "external_sourcing": {
    "possible": true,
    "sources": []
  },
  "stock_and_conservation": {
    "storage_mode": "CHILLED",
    "internal_shelf_life_hours": null,
    "after_opening_shelf_life_hours": null,
    "freezable": null,
    "thawing_rules_documented": null,
    "current_stock_units": null,
    "minimum_stock_units": null,
    "target_stock_units": null,
    "expected_waste_rate": null,
    "conservation_notes": null
  },
  "decision_inputs": {
    "customer_indifference_score": null,
    "supplier_quality_advantage_score": null,
    "labor_saving_score": null,
    "purchasing_stock_simplification_score": null,
    "conservation_advantage_score": null,
    "traceability_advantage_score": null,
    "supplier_risk_score": null,
    "recommended_mode": "UNDECIDED",
    "decision_status": "PROVISIONAL",
    "decision_notes": null
  },
  "data_quality": {
    "confidence": "LOW",
    "missing_critical_fields": [
      "dietary.vegan",
      "dietary.claim_evidence",
      "external_sourcing.sources",
      "internal_production.operations",
      "internal_production.batch_size_units",
      "internal_production.material_cost_eur",
      "stock_and_conservation.internal_shelf_life_hours"
    ],
    "sources": [
      "Doctrine interne Make_or_Buy"
    ],
    "last_reviewed": "2026-09-10",
    "review_notes": null
  }
}
